{
  "h2a_version": "0.1",
  "profile": "h2a-memory",
  "grant_id": "3f2a1c40-0d1e-4b2a-9c33-8a1b2c3d4e5f",
  "subject_ref": "urn:h2a:subject:jane-actor-001",
  "record": { "record_id": "mem-1", "memory_type": "derived", "content_hash": "sha256:cccccccccccccccccccccccccccccccccccccccccccccccccccccccccccccccc" },
  "provenance": { "sources": [ { "source_ref": "transcript:call-7", "method": "summarise" } ] },
  "retention": { "retention_horizon": "P90D", "deletion_on_revoke": true }
}
